{
  "schema_version": "0.1",
  "skill_id": "regenerative-knowledge-commons",
  "identity": {
    "name": "Regenerative Knowledge Commons",
    "summary": "Turns project learning into reusable, governed and correctable shared knowledge.",
    "publisher": "ChatGPT Skills project"
  },
  "provenance": {
    "source_repository": "https://github.com/eusourmr/chatgpt-skills",
    "canonical_path": "skills/regenerative-knowledge-commons",
    "reviewed_source_revision": "ab8cb8cd7e2c7ca5c9bb73800552b25e361a0098",
    "license": "MIT"
  },
  "integrity": {
    "algorithm": "sha256-manifest-v1",
    "artifact_sha256": "718d625749708581f8fab07448782118a51cf2c25deaf7bb6432801690e982fd",
    "files": [
      {
        "path": "SKILL.md",
        "sha256": "f3b99094df69c415ec48e6739cc3cfb71c33a7e8f11f3c3ab28e699426461b1f"
      },
      {
        "path": "agents/openai.yaml",
        "sha256": "e9f6fd1df94353ff8bb2ac300da1bbc6cd0ac386e4e3acfa0b660ac85512db62"
      }
    ]
  },
  "execution": {
    "mode": "chat-native",
    "evidence_state": "designed",
    "minimum_setup": "Install/load the skill, then continue in the same chat.",
    "required_capabilities": []
  },
  "permissions": {
    "local_files": "none required by the packaged instruction skill",
    "network": "none required",
    "secrets": "none required",
    "process_execution": "none required",
    "destructive_actions": "none required"
  },
  "security": {
    "state": "inspected",
    "gate_version": "v2",
    "evidence_refs": [
      "trust/skills.json",
      "scripts/security-gate-v2.mjs",
      "trust/security-reports/regenerative-knowledge-commons.json",
      "trust/risk-labels/regenerative-knowledge-commons.json"
    ],
    "report_ref": "trust/security-reports/regenerative-knowledge-commons.json",
    "risk_label_ref": "trust/risk-labels/regenerative-knowledge-commons.json"
  },
  "behavior_evidence": {
    "state": "designed",
    "latest_plan_id": null,
    "latest_run_id": null,
    "evidence_refs": [
      "trust/skills.json",
      "trust/execution.json"
    ]
  },
  "freshness": {
    "status": "current",
    "reviewed_at": "2026-09-30",
    "stale_after_days": 90,
    "review_due_at": "2026-12-29"
  },
  "governance": {
    "maintainers": [
      {
        "github": "eusourmr",
        "role": "maintainer"
      }
    ],
    "reviewers": [
      {
        "github": "eusourmr",
        "role": "author-maintainer-reviewer",
        "conflict_of_interest": "self-review"
      }
    ],
    "independent_review": false
  },
  "recommendation": {
    "state": "conditional",
    "reason": "Bundled, source-reviewed and integrity-checked; dedicated task-level end-to-end evidence is still incomplete."
  },
  "known_gaps": [
    "No dedicated outcome fixture measuring task-level effectiveness yet."
  ]
}
