{
  "schema_version": "0.1",
  "skill_id": "cs-navigator",
  "identity": {
    "name": "CS Navigator",
    "summary": "Evergreen capability curator with relevance-gated Curator Offer, native-first routing, and read-only registry-backed capability/evidence discovery.",
    "publisher": "ChatGPT Skills project"
  },
  "provenance": {
    "source_repository": "https://github.com/eusourmr/chatgpt-skills",
    "canonical_path": "skills/featured/cs-navigator",
    "reviewed_source_revision": "551ad8162687992a888502d63a633afd4d656883",
    "license": "MIT"
  },
  "integrity": {
    "algorithm": "sha256-manifest-v1",
    "artifact_sha256": "aca9abf81e5be0c96c7cb504bb7d72cb68340d993d075a04320f063549c93116",
    "files": [
      {
        "path": "SKILL.md",
        "sha256": "8c2cb8afb155ff8de9d14ff0d5bbca65ad3860d60d1fbbd61467dd087fe6f30a"
      },
      {
        "path": "agents/openai.yaml",
        "sha256": "d65c40881cee2ab40c7fe68025fd01f308e3ec7671c3eca0b23af92b06470e1a"
      },
      {
        "path": "references/catalog-snapshot.json",
        "sha256": "0d5533bc2193b2f3818137c9e6f347168e1535eb0bedde4563907263f91ba05e"
      },
      {
        "path": "references/container-default-policy.json",
        "sha256": "63a54b8060c170445ec58dccdf5e2f1def01011f93de00c2053f178bf8e0e487"
      },
      {
        "path": "references/container-guardian-runtime-eval.json",
        "sha256": "fc50499073aaaa29e11e302f7f06202e14feab648a248a488dc9181320df68fc"
      },
      {
        "path": "references/first-party-capabilities.json",
        "sha256": "29f5715e0f6f042214c83d1534c59ce7e1194343538740eeadc5621f7529e2cb"
      },
      {
        "path": "references/human-capability-registry.json",
        "sha256": "c37dd028dd2c06cbfb970e0f222181e6131d551620b25dc8a800123c7d900a38"
      }
    ]
  },
  "execution": {
    "mode": "connected",
    "evidence_state": "designed",
    "minimum_setup": "Install CS Navigator 0.16.0 and connect the read-only CS Registry MCP after the production endpoint is approved. Native fallback remains available when the registry is unavailable.",
    "required_capabilities": [
      "remote-mcp-read-only"
    ]
  },
  "permissions": {
    "local_files": "none required by the chat-native workflow; it reads only its bundled reference snapshot through the skill runtime",
    "network": "none required",
    "secrets": "none required",
    "process_execution": "none required",
    "destructive_actions": "none required"
  },
  "security": {
    "state": "inspected",
    "gate_version": "v2",
    "evidence_refs": [
      "trust/skills.json",
      "scripts/security-gate-v2.mjs",
      "trust/security-reports/cs-navigator.json",
      "trust/risk-labels/cs-navigator.json"
    ],
    "report_ref": "trust/security-reports/cs-navigator.json",
    "risk_label_ref": "trust/risk-labels/cs-navigator.json"
  },
  "behavior_evidence": {
    "state": "designed",
    "latest_plan_id": "cs-navigator-chatgpt-v10-cs-connect-v090-r2",
    "latest_run_id": "cs-navigator-chatgpt-v10-cs-connect-v090-r2",
    "evidence_refs": [
      "trust/skills.json",
      "trust/execution.json",
      "trust/in-product-tests.json",
      "trust/in-product-runs.json"
    ]
  },
  "freshness": {
    "status": "current",
    "reviewed_at": "2026-10-11",
    "stale_after_days": 90,
    "review_due_at": "2027-01-09"
  },
  "governance": {
    "maintainers": [
      {
        "github": "eusourmr",
        "role": "maintainer"
      }
    ],
    "reviewers": [
      {
        "github": "eusourmr",
        "role": "author-maintainer-reviewer",
        "conflict_of_interest": "self-review"
      }
    ],
    "independent_review": false
  },
  "recommendation": {
    "state": "conditional",
    "reason": "Bundled, source-reviewed and integrity-checked; dedicated task-level end-to-end evidence is still incomplete."
  },
  "known_gaps": [
    "0.17 Curator Offer behavior is pending native semantic qualification.",
    "Production HTTPS MCP endpoint for the Evergreen architecture is still a 0.16 release dependency.",
    "Cross-chat curator persistence remains host-dependent and is not claimed.",
    "New learning/academic registry capabilities remain individually designed.",
    "Container Guardian execution cannot be claimed without an actual runtime decision record."
  ]
}
