{
  "schema_version": "0.1",
  "skill_id": "regenerative-adaptive-experiment",
  "identity": {
    "name": "Regenerative Adaptive Experiment",
    "summary": "Turns uncertainty into a small reversible experiment with explicit learning and harm checks.",
    "publisher": "ChatGPT Skills project"
  },
  "provenance": {
    "source_repository": "https://github.com/eusourmr/chatgpt-skills",
    "canonical_path": "skills/regenerative-adaptive-experiment",
    "reviewed_source_revision": "fb595c02abb77dc213b1e0b1ae41aea46932aa39",
    "license": "MIT"
  },
  "integrity": {
    "algorithm": "sha256-manifest-v1",
    "artifact_sha256": "4e698fc8c755144202f41d3ec59353370f8cf52dabca4006c2c81b61d434980f",
    "files": [
      {
        "path": "SKILL.md",
        "sha256": "f60e5216bf4f3848c94074a53a83db2fb558278f976023c5f5374db57472b2c2"
      },
      {
        "path": "agents/openai.yaml",
        "sha256": "50b0a97c52f09ef908c180cce7f802e229f75d5227b11f1f2ead456bc6d5054d"
      }
    ]
  },
  "execution": {
    "mode": "chat-native",
    "evidence_state": "designed",
    "minimum_setup": "Install/load the skill, then continue in the same chat.",
    "required_capabilities": []
  },
  "permissions": {
    "local_files": "none required by the packaged instruction skill",
    "network": "none required",
    "secrets": "none required",
    "process_execution": "none required",
    "destructive_actions": "none required"
  },
  "security": {
    "state": "inspected",
    "gate_version": "v2",
    "evidence_refs": [
      "trust/skills.json",
      "scripts/security-gate-v2.mjs",
      "trust/security-reports/regenerative-adaptive-experiment.json",
      "trust/risk-labels/regenerative-adaptive-experiment.json"
    ],
    "report_ref": "trust/security-reports/regenerative-adaptive-experiment.json",
    "risk_label_ref": "trust/risk-labels/regenerative-adaptive-experiment.json"
  },
  "behavior_evidence": {
    "state": "designed",
    "latest_plan_id": "regenerative-adaptive-experiment-chatgpt-v1-r6",
    "latest_run_id": "regenerative-adaptive-experiment-chatgpt-v1-r6",
    "evidence_refs": [
      "trust/skills.json",
      "trust/execution.json",
      "trust/in-product-tests.json",
      "trust/in-product-runs.json"
    ]
  },
  "freshness": {
    "status": "current",
    "reviewed_at": "2026-10-01",
    "stale_after_days": 90,
    "review_due_at": "2026-12-30"
  },
  "governance": {
    "maintainers": [
      {
        "github": "eusourmr",
        "role": "maintainer"
      }
    ],
    "reviewers": [
      {
        "github": "eusourmr",
        "role": "author-maintainer-reviewer",
        "conflict_of_interest": "self-review"
      }
    ],
    "independent_review": false
  },
  "recommendation": {
    "state": "conditional",
    "reason": "Bundled, source-reviewed and integrity-checked; dedicated task-level end-to-end evidence is still incomplete."
  },
  "known_gaps": [
    "No dedicated outcome fixture measuring task-level effectiveness yet."
  ]
}
