{
  "schema_version": "0.1",
  "skill_id": "regenerative-language-bridge",
  "identity": {
    "name": "Regenerative Language Bridge",
    "summary": "Explains complex material plainly while preserving technical precision and uncertainty.",
    "publisher": "ChatGPT Skills project"
  },
  "provenance": {
    "source_repository": "https://github.com/eusourmr/chatgpt-skills",
    "canonical_path": "skills/regenerative-language-bridge",
    "reviewed_source_revision": "fb595c02abb77dc213b1e0b1ae41aea46932aa39",
    "license": "MIT"
  },
  "integrity": {
    "algorithm": "sha256-manifest-v1",
    "artifact_sha256": "207fa1b2df267d7b90678b53e9514f2cc0257b57a76372245b5cb639c5e731c4",
    "files": [
      {
        "path": "SKILL.md",
        "sha256": "4524c9e2eab6a106b01a00c7aedb7a70e9b75dc389c9d3cbba37ff2cbd01e2e7"
      },
      {
        "path": "agents/openai.yaml",
        "sha256": "dcf9b3d504f14e58dc9a5b0cfd3f11009cfb27408013386aa92660692219faa2"
      }
    ]
  },
  "execution": {
    "mode": "chat-native",
    "evidence_state": "designed",
    "minimum_setup": "Install/load the skill, then continue in the same chat.",
    "required_capabilities": []
  },
  "permissions": {
    "local_files": "none required by the packaged instruction skill",
    "network": "none required",
    "secrets": "none required",
    "process_execution": "none required",
    "destructive_actions": "none required"
  },
  "security": {
    "state": "inspected",
    "gate_version": "v2",
    "evidence_refs": [
      "trust/skills.json",
      "scripts/security-gate-v2.mjs",
      "trust/security-reports/regenerative-language-bridge.json",
      "trust/risk-labels/regenerative-language-bridge.json"
    ],
    "report_ref": "trust/security-reports/regenerative-language-bridge.json",
    "risk_label_ref": "trust/risk-labels/regenerative-language-bridge.json"
  },
  "behavior_evidence": {
    "state": "designed",
    "latest_plan_id": "regenerative-language-bridge-chatgpt-v1-r6",
    "latest_run_id": "regenerative-language-bridge-chatgpt-v1-r6",
    "evidence_refs": [
      "trust/skills.json",
      "trust/execution.json",
      "trust/in-product-tests.json",
      "trust/in-product-runs.json"
    ]
  },
  "freshness": {
    "status": "current",
    "reviewed_at": "2026-10-01",
    "stale_after_days": 90,
    "review_due_at": "2026-12-30"
  },
  "governance": {
    "maintainers": [
      {
        "github": "eusourmr",
        "role": "maintainer"
      }
    ],
    "reviewers": [
      {
        "github": "eusourmr",
        "role": "author-maintainer-reviewer",
        "conflict_of_interest": "self-review"
      }
    ],
    "independent_review": false
  },
  "recommendation": {
    "state": "conditional",
    "reason": "Bundled, source-reviewed and integrity-checked; dedicated task-level end-to-end evidence is still incomplete."
  },
  "known_gaps": [
    "No dedicated outcome fixture measuring task-level effectiveness yet."
  ]
}
