{
  "schema_version": "0.1",
  "skill_id": "regenerative-impact-map",
  "identity": {
    "name": "Regenerative Impact Map",
    "summary": "Maps a decision across systemic lenses, loops, spillovers and leverage points.",
    "publisher": "ChatGPT Skills project"
  },
  "provenance": {
    "source_repository": "https://github.com/eusourmr/chatgpt-skills",
    "canonical_path": "skills/regenerative-impact-map",
    "reviewed_source_revision": "64c2e06e7feee917096f0f7091bbb51db5da1f97",
    "license": "MIT"
  },
  "integrity": {
    "algorithm": "sha256-manifest-v1",
    "artifact_sha256": "fbf0bd0a93bd1d0a7c14593bdd4d8cfc81dea92bef619de37cdfcdbb0703ad69",
    "files": [
      {
        "path": "SKILL.md",
        "sha256": "297aa061d025bb80f56de6b09dfb972c0515d419da443119c21cd8bdcd88984e"
      },
      {
        "path": "agents/openai.yaml",
        "sha256": "28fcb5ecec99b03efac7657351bd1cf53ffa92f81d06904cece9b28a2f800f73"
      }
    ]
  },
  "execution": {
    "mode": "chat-native",
    "evidence_state": "designed",
    "minimum_setup": "Install/load the skill, then continue in the same chat.",
    "required_capabilities": []
  },
  "permissions": {
    "local_files": "none required by the packaged instruction skill",
    "network": "none required",
    "secrets": "none required",
    "process_execution": "none required",
    "destructive_actions": "none required"
  },
  "security": {
    "state": "inspected",
    "gate_version": "v2",
    "evidence_refs": [
      "trust/skills.json",
      "scripts/security-gate-v2.mjs",
      "trust/security-reports/regenerative-impact-map.json",
      "trust/risk-labels/regenerative-impact-map.json"
    ],
    "report_ref": "trust/security-reports/regenerative-impact-map.json",
    "risk_label_ref": "trust/risk-labels/regenerative-impact-map.json"
  },
  "behavior_evidence": {
    "state": "designed",
    "latest_plan_id": "regenerative-impact-map-chatgpt-v1-r6",
    "latest_run_id": "regenerative-impact-map-chatgpt-v1-r6",
    "evidence_refs": [
      "trust/skills.json",
      "trust/execution.json",
      "trust/in-product-tests.json",
      "trust/in-product-runs.json"
    ]
  },
  "freshness": {
    "status": "current",
    "reviewed_at": "2026-09-30",
    "stale_after_days": 90,
    "review_due_at": "2026-12-29"
  },
  "governance": {
    "maintainers": [
      {
        "github": "eusourmr",
        "role": "maintainer"
      }
    ],
    "reviewers": [
      {
        "github": "eusourmr",
        "role": "author-maintainer-reviewer",
        "conflict_of_interest": "self-review"
      }
    ],
    "independent_review": false
  },
  "recommendation": {
    "state": "conditional",
    "reason": "Bundled, source-reviewed and integrity-checked; dedicated task-level end-to-end evidence is still incomplete."
  },
  "known_gaps": [
    "No dedicated outcome fixture measuring task-level effectiveness yet."
  ]
}
